script,year,character,gender,line,stereotype_type,rewritten_line
Haider,,Haider,male,Haider stands in front of the numbered graveyard.,occupation_gap,"Haider stands in front of the numbered graves, contemplating the lives lost."
Haider,,Haider,male,Haider stands looking down at the silent ﬂowing water.,occupation_gap,"Haider gazes at the tranquil water, contemplating his next move."
Haider,,Ghazala,female,Ghazala wakes up with a start. Morning sunlight is coming,none,Ghazala wakes up with a start. Morning sunlight is coming
Haider,,Ghazala,female,Ghazala listens to a bell ringing on the receiver of a telephone.,occupation_gap,Ghazala answers the phone and hears a bell ringing.
Haider,,Ghazala,female,Ghazala turns to look at him.,appearance_focus,"Ghazala turns to look at him, feeling confident in her own skin."
Haider,,Salman,male,photographs of Haider at Downtown bridge. Salman,occupation_gap,Haider is seen taking photographs at the Downtown bridge.
Haider,,Salman,male,and Salman on either side of the table. A back shot of,occupation_gap,"Salman and his colleagues at the table, working together to achieve their goals."
Haider,,Salman,male,meet with Parvez’s. A beat. Salman brings out an electronic,occupation_gap,Salman brings out an electronic device to meet with Parvez.
Haider,,Haider,male,Parvez turns to Khurram and points at Haider in the,occupation_gap,"Parvez turns to Khurram and says, 'Haider is an aspiring musician, just like you were.'""

Line: ""She's a doctor, but she's"
Haider,,Haider,male,We can get to him via Haider…,occupation_gap,"We can reach him through Haider, who is a skilled and ambitious detective."
Haider,,Haider,male,We’ll have to watch out for Haider... Together.,agency_gap,Haider is ambitious and we need to work together to achieve our goals.
Haider,,Ghazala,female,Ghazala ties a thread and prays. She takes the maulvi’s,occupation_gap,"Ghazala ties a thread and prays. She takes the maulvi’s advice, but also follows her own ambition and seeks equality in her community."
Haider,,Ghazala,female,Khurram and Ghazala travel in the car. She looks out of,appearance_focus,Khurram and Ghazala drive together. She takes in the view.
Haider,,Ghazala,female,It takes Khurram a moment to recognize him. Ghazala also,occupation_gap,Khurram and Ghazala both recognize him.
Haider,,Haider,male,comes out. She is shocked to see Haider in this new avatar.,relationship_only,Haider surprises her with his new look.
Haider,,Ghazala,female,starts jumping. Tears are streaming off Ghazala’s eyes. She,relationship_only,"Ghazala jumps, tears streaming down her face. She"
Haider,,Haider,male,"Khurram moves ahead towards Haider, followed by his",occupation_gap,She is
Haider,,Haider,male,Haider turns back to see Khurram surrounded by,occupation_gap,Haider turns back to see Khurram working on his project with a group of colleagues.
Haider,,Haider,male,Haider stops and looks at him.,none,Haider stops and looks at him.
Haider,,Haider,male,Haider comes to the car and stands in front of the window.,occupation_gap,Haider approaches the car and positions himself in front of the window.
Haider,,Ghazala,female,"Ghazala looks at him, her face drowned in tears.",appearance_focus,Ghazala's face is filled with tears as she looks at him.
Haider,,Haider,male,Haider raises his eyebrows to tease them.,appearance_focus,"Haider raises his eyebrows, confident in his appearance."
Haider,,Haider,male,"Faraway, Haider, still dressed in the same suit, plays cricket",occupation_gap,She's a nurse
Haider,,Haider,male,Khurram opens the ﬁle on a small table as Haider looks on.,occupation_gap,"Khurram opens the ﬁle on a small table, and Haider watches with interest."
Haider,,Haider,male,"He picks a photograph and holds it for Haider. It’s Roohdaar,",occupation_gap,"Haider holds a photograph of Roohdaar, who is a talented photographer."
Haider,,Haider,male,looking totally different. Haider is shocked.,appearance_focus,She
Haider,,Haider,male,"to Haider, she looks quite angry.",appearance_focus,Haider notices her anger.
Haider,,Haider,male,"Haider is quiet, still lost in Khurram’s episode. She shakes",relationship_only,"Haider is lost in Khurram’s episode, but he's not afraid to express his feelings."
Haider,,Haider,male,Haider looks at her and smiles weakly.,agency_gap,"Haider looks at her and smiles, feeling a mix of emotions."
Haider,,Ghazala,female,"along with the priest, while Ghazala counts chickpeas in",relationship_only,"Ghazala, who is also a skilled cook, prepares a meal for the group, including the priest."
Haider,,Haider,male,an earthen pot full of water. Arshia sits with Haider at the,occupation_gap,Arshia and Haider sit together with a pot of water.
Haider,,Haider,male,law live a widow’s life... and my dearest Haider,relationship_only,"Haider, who has been living a widow's life, and I"
Haider,,Salman,male,Salman and Salman take the cue and whispers loudly and,occupation_gap,Salman and Salman share a moment of understanding and
Haider,,Ghazala,female,Ghazala has a timid smile on her face. Haider's jaws tighten,appearance_focus,"Ghazala gives Haider a warm smile, and he feels a sense of comfort."
Haider,,Haider,male,Khurram looks at Haider and smiles. Haider’s eyes display,occupation_gap,Khurram looks at Haider and smiles. Haider’s eyes display determination and ambition.
Haider,,Ghazala,female,hatred and hurt. Khurram’s smile fades out. Ghazala follows,agency_gap,"Khurram's smile fades out as he realizes the depth of his hatred and hurt. Ghazala follows, determined to help him overcome these feelings."
Haider,,Haider,male,to see him so cheerful. Haider notices her while dancing. He,relationship_only,Haider notices her while dancing. She's happy to see him.
Haider,,Salman,male,He grabs her hand and runs deeper into the village. Salman,occupation_gap,Salman grabs her hand and runs deeper into the village.
Haider,,Salman,male,and Salman follow them. A chase begins - Haider manages,occupation_gap,Haider manages to catch up with Salman and they engage in a chase.
Haider,,Haider,male,"the claustrophobic conﬁnes of the hollow tree, Haider and",occupation_gap,"Haider, trapped in the confined space of the hollow tree, felt the weight of his ambition pressing down on him."
Haider,,Haider,male,Promise me… Haider... You will do no such thing.,agency_gap,"Haider, I trust you to make your own decisions."
Haider,,Haider,male,Haider looks away. She puts his hand over her head.,relationship_only,Haider looks away. He puts his hand over her head.
Haider,,Haider,male,"arms, Haider walks up to him and hugs him tight.",appearance_focus,Haider approaches him and they share a warm embrace.
Haider,,Ghazala,female,Haider reaches Ghazala’s room. She looks beautiful in a,appearance_focus,"Haider reaches Ghazala’s room. She is confident and radiant, wearing a"
Haider,,Ghazala,female,bride’s attire. Ghazala looks at him in the mirror. She turns,appearance_focus,"Ghazala examines her reflection, considering her attire for the wedding. She turns to him."
Haider,,Haider,male,She pulls herself back to look at him and laughs. Haider,none,She pulls herself back to look at him and laughs. Haider
Haider,,Ghazala,female,Ghazala’s smile fades out. Haider suddenly laughs.,relationship_only,"Ghazala’s smile fades out, but she quickly regains her composure and continues to pursue her goals."
Haider,,Ghazala,female,Khurram looks at Ghazala who is sitting with a few women,relationship_only,Khurram notices Ghazala and her female companions.
Haider,,Haider,male,Haider hides his pistol inside the ﬂush tank.,occupation_gap,Haider conceals his weapon in the toilet.
Haider,,Ghazala,female,Khurram Hussain Meer... do you accept Ghazala,occupation_gap,"Khurram Hussain Meer, do you accept Ghazala as your equal partner in life and career?"
Haider,,Ghazala Akhtar,female,Ghazala Akhtar... Do you accept Khurram Hussain,relationship_only,"Ghazala Akhtar, do you want to be with Khurram Hussain?"
Haider,,Haider,male,Ghazala keeps looking down. Haider looks at her while,relationship_only,"Ghazala looks up at Haider, who is looking at her."
Haider,,Ghazala,female,standing at the door. On his face we hear Ghazala’s voice.,relationship_only,Ghazala's voice reaches him from the door.
Haider,,Ghazala,female,Guests congratulate Ghazala and Khurram who sit at the,relationship_only,"Ghazala and Khurram, who have worked hard to achieve their goals, are congratulated by guests as they sit together."
Haider,,Haider,male,"narrator, a masked Haider, begins the play. The players -",occupation_gap,"Haider, a masked narrator, begins the play. The players -"
Haider,,Ghazala,female,"Ghazala and Khurram are visibly disturbed. Khurram,",appearance_focus,"Ghazala and Khurram are visibly disturbed. Khurram, you're upset. What's wrong?"
Haider,,Haider,male,dance move Haider kneels before Khurram to end the,relationship_only,"Haider kneels before Khurram to end the conflict, but not because of any gender-based expectations."
Haider,,Haider,male,Khurram claps gently. He inches closer towards Haider and,occupation_gap,Khurram approaches Haider with a gentle clap and
Haider,,Haider,male,"Haider is silent. Khurram pulls down his mask, to reveal his",occupation_gap,"Haider is silent. Khurram removes his mask, to reveal his"
Haider,,Zahoor Hussain,male,Who wrote this play? Zahoor Hussain?  Or was it,occupation_gap,"Who wrote this play? Zahoor Hussain?  Or was it someone else?""

Line: ""She's a nurse.  She'"
Haider,,Haider,male,"Haider is shocked, his eyes dart towards Arshia who is",occupation_gap,"Haider is surprised to see Arshia, who is"
Haider,,Haider,male,Haider is seething with anger. Khurram looks at Parvez and,occupation_gap,"Haider is seething with anger. Khurram looks at Parvez, who is calmly trying to de-escalate the situation."
Haider,,Ghazala,female,nods. Parvez nods to a policeman in turn. Ghazala looks at,occupation_gap,"nods. Parvez nods to a policeman in turn. Ghazala, a determined and ambitious young woman, looks at"
Haider,,Haider,male,Haider looks at the policeman walking towards him. He,occupation_gap,Haider observes the policeman approaching him.
Haider,,Salman,male,Salman and Salman appear from nowhere. One of them hits,occupation_gap,Two men emerge from the shadows. One of them lunges forward and strikes
Haider,,Haider,male,him hard on the back of his head with a wooden log. Haider,occupation_gap,"Haider, determined to succeed, worked tirelessly to build his business."
Haider,,Ghazala,female,"an injection on his arm. Ghazala sits next to him, silently",agency_gap,Ghazala silently observes as he receives an injection on his arm.
Haider,,Ghazala,female,Khurram sits next to Ghazala who still brushes Haider’s,relationship_only,"Khurram and Ghazala sit next to Haider, each with their own tasks and responsibilities."
Haider,,Ghazala,female,Ghazala. He looks at Haider sleeping like a baby.,appearance_focus,Ghazala. She gazes at Haider sleeping peacefully.
Haider,,Haider,male,don’t care if Haider has to die.,agency_gap,Haider is willing to risk his life to save the world.
Haider,,Ghazala,female,Haider sleeps on the bed. Ghazala sleeps next to him on a,relationship_only,"Haider and Ghazala share a bed, each with their own space."
Haider,,Haider,male,next to Haider and slowly takes Ghazala’s hand off his chest,relationship_only,"Haider and Ghazala hold hands, both equally invested in their relationship."
Haider,,Ghazala,female,Ghazala slowly wakes up. Hilaal looks at her expressionless.,occupation_gap,"Ghazala opens her eyes and looks at Hilaal, who is concerned about her."
Haider,,Haider,male,She is shocked. Hilaal looks back at the sleeping Haider and,relationship_only,"Hilaal looks back at the sleeping Haider, and she feels a mix of emotions."
Haider,,Ghazala,female,"comes out and looks at Ghazala, she is still asleep.",appearance_focus,Ghazala is still asleep as she comes out.
Haider,,Haider,male,"prayer, his back towards Haider. Khurram murmurs the",occupation_gap,Haider turns away from Khurram as he prays.
Haider,,Salman,male,"Parvez drives up at the house, followed by Salman and",occupation_gap,"Parvez, Salman, and others arrive at the house."
Haider,,Salman,male,"Salman in a jeep. The guards salute Parvez, as he steps out",occupation_gap,"Salman and Parvez, both in their own vehicles, drive up to the guards. The guards salute them as they step out."
Haider,,Haider,male,"Haider is now right behind him, his hand trembles as he raises",occupation_gap,"Haider steps forward, his hand steady as he raises"
Haider,,Haider,male,ﬂinch an inch. Haider’s ﬁnger is on the trigger.,occupation_gap,"Haider's finger is on the trigger, ready to act."
Haider,,Salman,male,Haider comes out of the prayer room to face Salman and,occupation_gap,Haider emerges from the prayer room and confronts Salman.
Haider,,Salman,male,Salman along with Parvez standing at the door.,occupation_gap,Salman and Parvez stand at the door.
Haider,,Salman,male,"Parvez lunges at him, Haider’s pistol ﬂies away. Salman and",occupation_gap,"Parvez lunges at him, but Haider manages to dodge the attack. Salman and"
Haider,,Ghazala,female,Ghazala comes out hearing the commotion. Khurram walks,occupation_gap,Ghazala hears the commotion and rushes out to see what's happening. Khurram follows her.
Haider,,Salman,male,out still wearing his prayer cap. Salman and Salman hold,occupation_gap,"Salman, still wearing his prayer cap, holds a conversation with his friend."
Haider,,Haider,male,a fuming Haider. Parvez ties Haider’s hands with his red,occupation_gap,"Haider, frustrated, ties his own hands with red."
Haider,,Haider,male,"Khurram looks at Haider, who smiles.",none,"Khurram looks at Haider, who smiles."
